{
  "anything": {
    "any": "value"
  },
  "list": [
    1,
    "two",
    null,
    false
  ],
  "bag": {
    "a": 1,
    "b": [
      2
    ]
  },
  "closedTuple": [
    "abc",
    7
  ],
  "legacyClosed": [
    true,
    "x"
  ],
  "eitherOr": "either",
  "closedBag": {
    "named": "value"
  }
}